{
  "catalogue": {
    "id": "amani-resorts-circuits-2026",
    "brand": "Amani Resorts",
    "project": "Coworkation Eco-Comores",
    "title": { "fr": "Circuits & activités", "en": null },
    "version": "1.0.0",
    "last_updated": "2026-09-17",
    "beneficiary": "Comores Coworking (ComWork Partners)",
    "location": "Moroni, Union des Comores",
    "booking_channel": "Application mobile Amani Resorts"
  },
  "universes": [
    {
      "id": "gastronomie-savoir-faire",
      "code": "A",
      "name": { "fr": "Gastronomie & savoir-faire local", "en": null },
      "description": { "fr": "Goûter, apprendre et créer aux côtés des artisans et familles comoriennes.", "en": null },
      "color": "#C66A4A",
      "sort_order": 1
    },
    {
      "id": "decouverte-terrestre",
      "code": "B",
      "name": { "fr": "Circuits & découverte terrestre", "en": null },
      "description": { "fr": "Découvrir Ngazidja de la côte aux flancs du Karthala, en véhicule, en quad, en buggy ou à pied.", "en": null },
      "color": "#37695C",
      "sort_order": 2
    },
    {
      "id": "mer-faune-marine",
      "code": "C",
      "name": { "fr": "Mer & faune marine", "en": null },
      "description": { "fr": "Explorer l’Océan Indien, ses récifs et sa faune marine dans le respect du vivant.", "en": null },
      "color": "#2F7E86",
      "sort_order": 3
    },
    {
      "id": "evasion-immersion",
      "code": "D",
      "name": { "fr": "Évasion & immersion", "en": null },
      "description": { "fr": "Prolonger l’expérience par un bivouac ou un séjour de plusieurs jours à Mohéli.", "en": null },
      "color": "#E8D8BD",
      "sort_order": 4
    }
  ],
  "providers": [
    {
      "id": "vlc",
      "name": "VLC",
      "positioning": { "fr": "Acteur local de la découverte et de l’immersion terrestre, gastronomique et culturelle.", "en": null },
      "status": "active_contract_formalization"
    },
    {
      "id": "discovermores",
      "name": "DISCOVERMORES",
      "positioning": { "fr": "Opérateur d’activités et de sports nature, de randonnée, de plongée et de découverte de la faune marine.", "en": null },
      "status": "active_contract_formalization"
    }
  ],
  "activities": [
    {
      "id": "activity-001",
      "catalogue_number": 1,
      "slug": "saveurs-comoriennes-chez-habitant",
      "universe_id": "gastronomie-savoir-faire",
      "provider_id": "vlc",
      "name": { "fr": "Saveurs comoriennes chez l’habitant", "en": null },
      "short_description": { "fr": "Préparez et dégustez des plats traditionnels dans une maison comorienne.", "en": null },
      "long_description": { "fr": "Partagez un moment authentique en préparant et en dégustant des plats traditionnels dans une maison comorienne, située dans la Médina de Moroni ou dans le village de Nioumadzaha Bambao.", "en": null },
      "islands": ["Ngazidja"],
      "locations": ["Médina de Moroni", "Nioumadzaha Bambao"],
      "tags": ["gastronomie", "chez l’habitant", "culture", "immersion"],
      "options": [], "included": [], "excluded": [],
      "booking": { "price": null, "currency": null, "duration_minutes": null, "min_capacity": null, "max_capacity": null, "meeting_point": null, "minimum_age": null, "physical_level": null, "cancellation_policy": null, "booking_enabled": false },
      "media": { "cover_image": "assets/activities/saveurs-comoriennes-chez-habitant/cover.webp", "gallery": [], "alt": { "fr": "Préparation d’un repas traditionnel comorien chez l’habitant", "en": null } },
      "featured": true, "active": true, "sort_order": 1
    },
    {
      "id": "activity-002", "catalogue_number": 2, "slug": "paint-and-discover", "universe_id": "gastronomie-savoir-faire", "provider_id": "vlc",
      "name": { "fr": "Paint & discover", "en": null },
      "short_description": { "fr": "Peignez en plein air tout en découvrant les paysages des Comores.", "en": null },
      "long_description": { "fr": "Alliez créativité et détente en laissant libre cours à vos pinceaux, tout en découvrant les magnifiques paysages des Comores.", "en": null },
      "islands": ["Non précisé"], "locations": [], "tags": ["peinture", "créativité", "paysage", "détente"],
      "options": [], "included": [], "excluded": [],
      "booking": { "price": null, "currency": null, "duration_minutes": null, "min_capacity": null, "max_capacity": null, "meeting_point": null, "minimum_age": null, "physical_level": null, "cancellation_policy": null, "booking_enabled": false },
      "media": { "cover_image": "assets/activities/paint-and-discover/cover.webp", "gallery": [], "alt": { "fr": "Atelier de peinture en plein air aux Comores", "en": null } },
      "featured": false, "active": true, "sort_order": 2
    },
    {
      "id": "activity-003", "catalogue_number": 3, "slug": "secrets-vanille", "universe_id": "gastronomie-savoir-faire", "provider_id": "vlc",
      "name": { "fr": "Les secrets de la vanille", "en": null },
      "short_description": { "fr": "Rencontrez les cultivateurs et découvrez la préparation de la vanille comorienne.", "en": null },
      "long_description": { "fr": "Partez à la rencontre des cultivateurs et initiez-vous à l’art de la préparation de la vanille comorienne.", "en": null },
      "islands": ["Non précisé"], "locations": [], "tags": ["vanille", "agriculture", "savoir-faire", "producteurs"],
      "options": [], "included": [], "excluded": [],
      "booking": { "price": null, "currency": null, "duration_minutes": null, "min_capacity": null, "max_capacity": null, "meeting_point": null, "minimum_age": null, "physical_level": null, "cancellation_policy": null, "booking_enabled": false },
      "media": { "cover_image": "assets/activities/secrets-vanille/cover.webp", "gallery": [], "alt": { "fr": "Culture et préparation de la vanille comorienne", "en": null } },
      "featured": true, "active": true, "sort_order": 3
    },
    {
      "id": "activity-004", "catalogue_number": 4, "slug": "initiation-menuiserie-comorienne", "universe_id": "gastronomie-savoir-faire", "provider_id": "vlc",
      "name": { "fr": "Initiation à la menuiserie comorienne", "en": null },
      "short_description": { "fr": "Découvrez le travail du bois et créez une pièce unique.", "en": null },
      "long_description": { "fr": "Initiez-vous au savoir-faire comorien du bois et repartez avec une pièce unique façonnée par vos soins.", "en": null },
      "islands": ["Non précisé"], "locations": [], "tags": ["menuiserie", "artisanat", "bois", "atelier"],
      "options": [], "included": [], "excluded": [],
      "booking": { "price": null, "currency": null, "duration_minutes": null, "min_capacity": null, "max_capacity": null, "meeting_point": null, "minimum_age": null, "physical_level": null, "cancellation_policy": null, "booking_enabled": false },
      "media": { "cover_image": "assets/activities/initiation-menuiserie-comorienne/cover.webp", "gallery": [], "alt": { "fr": "Initiation au travail artisanal du bois aux Comores", "en": null } },
      "featured": false, "active": true, "sort_order": 4
    },
    {
      "id": "activity-005", "catalogue_number": 5, "slug": "circuit-nord", "universe_id": "decouverte-terrestre", "provider_id": "vlc",
      "name": { "fr": "Circuit nord", "en": null },
      "short_description": { "fr": "Découvrez le nord de Ngazidja entre plages, histoire et paysages volcaniques.", "en": null },
      "long_description": { "fr": "Entre plage, histoire et paysages volcaniques, partez à la découverte du nord de la Grande Comore (Ngazidja).", "en": null },
      "islands": ["Ngazidja"], "locations": ["Nord de la Grande Comore"], "tags": ["circuit", "plage", "histoire", "volcan"],
      "options": [], "included": [], "excluded": [],
      "booking": { "price": null, "currency": null, "duration_minutes": null, "min_capacity": null, "max_capacity": null, "meeting_point": null, "minimum_age": null, "physical_level": null, "cancellation_policy": null, "booking_enabled": false },
      "media": { "cover_image": "assets/activities/circuit-nord/cover.webp", "gallery": [], "alt": { "fr": "Paysage côtier du nord de la Grande Comore", "en": null } },
      "featured": true, "active": true, "sort_order": 5
    },
    {
      "id": "activity-006", "catalogue_number": 6, "slug": "circuit-sud", "universe_id": "decouverte-terrestre", "provider_id": "vlc",
      "name": { "fr": "Circuit sud", "en": null },
      "short_description": { "fr": "Explorez le sud de Ngazidja entre panoramas, patrimoine et rencontres.", "en": null },
      "long_description": { "fr": "Cap vers le sud de la Grande Comore : vues panoramiques, patrimoine et rencontres locales.", "en": null },
      "islands": ["Ngazidja"], "locations": ["Sud de la Grande Comore"], "tags": ["circuit", "panorama", "patrimoine", "rencontres"],
      "options": [], "included": [], "excluded": [],
      "booking": { "price": null, "currency": null, "duration_minutes": null, "min_capacity": null, "max_capacity": null, "meeting_point": null, "minimum_age": null, "physical_level": null, "cancellation_policy": null, "booking_enabled": false },
      "media": { "cover_image": "assets/activities/circuit-sud/cover.webp", "gallery": [], "alt": { "fr": "Vue panoramique du sud de la Grande Comore", "en": null } },
      "featured": false, "active": true, "sort_order": 6
    },
    {
      "id": "activity-007", "catalogue_number": 7, "slug": "quad-nord", "universe_id": "decouverte-terrestre", "provider_id": "vlc",
      "name": { "fr": "Quad dans le nord", "en": null },
      "short_description": { "fr": "Explorez le nord de Ngazidja en quad.", "en": null },
      "long_description": { "fr": "Explorez le nord de la Grande Comore, entre Maloudja et le Dos du dragon, en quad.", "en": null },
      "islands": ["Ngazidja"], "locations": ["Maloudja", "Dos du dragon"], "tags": ["quad", "aventure", "nord", "volcan"],
      "options": [], "included": [], "excluded": [],